Type,Code,Name,Credits,Parents,YearStudy
knowledge,Khối kiến thức chung (chưa tính Giáo dục thể chất và Giáo dục quốc phòng - an ninh),;,;,;,0
compulsory,Các học phần bắt buộc,;,11,;,0
subject,PHI1006,Triết học Mác - Lênin,3,;,0
subject,PEC1008,Kinh tế chính trị Mác - Lênin,2,PHI1006,0
subject,PHI1002,Chủ nghĩa xã hội khoa học,2,;,0
subject,HIS1001,Lịch sử Đảng Cộng sản Việt Nam,2,;,0
subject,POL1001,Tư tưởng Hồ Chí Minh,2,;,0
optional,Ngoại ngữ B1,,5,,0
subject,FLF1107,Tiếng Anh B1,5,;,0
subject,FLF1307,Tiếng Pháp B1,5,;,0
subject,FLF1407,Tiếng Trung B1,5,;,0
knowledge,Khối kiến thức theo lĩnh vực,;,;,;,0
compulsory,Các học phần bắt buộc,;,2,;,0
subject,INM1000,Tin học cơ sở,2,;,0
optional,Các học phần tự chọn,;,5,;,0
subject,HIS1056,Cơ sở văn hóa Việt Nam,3,;,0
subject,GEO1050,Khoa học trái đất và sự sống,3,;,0
subject,THL1057,Nhà nước và pháp luật đại cương,2,PHI1006,0
subject,MAT1060,Nhập môn phân tích dữ liệu,2,;,0
subject,PHY1070,Nhập môn Internet kết nối vạn vật,2,;,0
subject,PHY1020,Nhập môn Robotics,3,;,0
knowledge,Khối kiến thức theo khối ngành,;,;,;,0
compulsory,Các học phần bắt buộc,;,6,;,0
subject,PHY1100,Cơ - Nhiệt,3,MAT2501,0
subject,PHY1103,Điện - Quang,3,MAT2501,0
knowledge,Khối kiến thức theo nhóm ngành,;,;,;,0
compulsory,Các học phần bắt buộc,;,30,;,0
subject,MAT2400,Đại số tuyến tính,5,;,0
subject,MAT2501,Giải tích 1,4,;,0
subject,MAT2502,Giải tích 2,4,MAT2501;MAT2400,0
subject,MAT2503,Giải tích 3,2,MAT2502,0
subject,MAT2403,Phương trình vi phân,3,MAT2501;MAT2400,0
subject,MAT2323,Xác suất - Thống kê,4,MAT2502,0
subject,MAT2407,Tối ưu hóa,3,MAT2502,0
subject,MAT2315,Phương pháp nghiên cứu khoa học,3,;,0
subject,MAT2506,Kĩ năng mềm,2,;,0
optional,Các học phần tự chọn,;,3,;,0
subject,MAT2316,Lập trình C++,3,INM1000,0
subject,MAT2317,Lập trình Java,3,INM1000,0
subject,MAT2318,Lập trình Python,3,INM1000,0
subject,MAT2319,Lập trình Julia,3,INM1000,0
knowledge,Khối kiến thức ngành,;,;,;,0
compulsory,Các học phần bắt buộc,;,44,;,0
subject,MAT3500,Toán rời rạc,4,MAT2400;MAT2501,0
subject,MAT3501,Nguyên lý hệ điều hành,3,MAT2316/MAT2317/MAT2318/MAT2319,0
subject,MAT3514,Cấu trúc dữ liệu và thuật toán,4,MAT2316/MAT2317/MAT2318/MAT2319,0
subject,MAT3372,Các thành phần phần mềm,3,MAT2316/MAT2317/MAT2318/MAT2319,0
subject,MAT3504,Thiết kế và đánh giá thuật toán,3,MAT2502;MAT2316/MAT2317/MAT2318/MAT2319,0
subject,MAT3505,Kiến trúc máy tính,3,MAT2316/MAT2317/MAT2318/MAT2319,0
subject,MAT3373,Nhập môn an toàn máy tính,3,MAT2316/MAT2317/MAT2318/MAT2319,0
subject,MAT3506,Mạng máy tính,3,MAT2316/MAT2317/MAT2318/MAT2319,0
subject,MAT3507,Cơ sở dữ liệu,4,MAT2316/MAT2317/MAT2318/MAT2319,0
subject,MAT3508,Nhập môn Trí tuệ nhân tạo,3,MAT3372;MAT3507,0
subject,MAT3374,Thực tập thực tế phát triển phần mềm,3,INM1000;MAT3507,0
subject,MAT3543,Công nghệ phần mềm,3,MAT3374;MAT3504,0
subject,MAT3541,Nguyên lý các ngôn ngữ lập trình,3,MAT2316/MAT2317/MAT2318/MAT2319,0
subject,MAT3557,Môi trường lập trình Linux,2,;,0
mainDesOptionalAND,Các học phần tự chọn,;,;,;,0
optional,Tự chọn về kỹ năng phần mềm,;,4,;,0
subject,MAT3376,Lập trình nâng cao,2,MAT2316/MAT2317/MAT2318/MAT2319,0
subject,MAT3525,Thực hành tính toán,2,MAT2502,0
subject,MAT3516,Thực hành hệ thống trợ giúp quyết định,2,MAT3507,0
optional,Tự chọn về khoa học máy tính và thông tin,;,15,;,0
subject,MAT3531,Tính toán phân tán,3,MAT3501;MAT3372,0
subject,MAT3533,Học máy,3,MAT2323;MAT3514;MAT2034,0
subject,MAT3534,Khai phá dữ liệu,3,MAT3507;MAT2323,0
subject,MAT3536,Ngôn ngữ học tính toán,3,MAT3509;MAT3508,0
subject,MAT3562,Thị giác máy tính,3,MAT3533,0
subject,MAT3538,Các hệ thống tri thức,3,MAT3508;MAT3514;MAT3372,0
subject,MAT3509,Ngôn ngữ hình thức và ôtômat,3,MAT3500;MAT2316/MAT2317/MAT2318/MAT2319,0
subject,MAT3539,Mật mã và an toàn dữ liệu,3,MAT2316/MAT2317/MAT2318/MAT2319,0
subject,MAT3540,Cơ sở dữ liệu đa phương tiện,3,MAT3507,0
subject,MAT3542,Phát triển ứng dụng web,3,MAT3374,0
subject,MAT3452,Phân tích thống kê nhiều chiều,3,MAT2323,0
subject,MAT3453,Phương pháp chọn mẫu dữ liệu,3,MAT2323,0
subject,MAT2034,Giải tích số,3,MAT2502;MAT2403;MAT3372,0
knowledge,Khối kiến thức thực tập và tốt nghiệp,;,;,;,0
mainDesOptional,Chọn Khóa luận tốt nghiệp hoặc Các học phần thay thế,;,;,;,0
optional,Khóa luận tốt nghiệp,;,7,;,0
subject,MAT4080,Khóa luận tốt nghiệp,7,;,0
optional,Các học phần thay thế,;,7,;,0
subject,MAT3544,Phân tích và thiết kế hệ thống thông tin,4,MAT3574;MAT3504,0
subject,MAT3535,Tìm kiếm thông tin,3,MAT3514,0
